{
  "suite_id": "forgeops-local-vertical-v1",
  "suite_version": "1.0",
  "schema_ref": "contracts/forgeops-local-vertical/1.0/schema.json",
  "product_schema_ref": "contracts/product-task-contract/1.0/schema.json",
  "snapshot_schema_ref": "contracts/forgeops-snapshot-contract/1.0/schema.json",
  "context_schema_ref": "contracts/forgeops-context-pack/1.0/schema.json",
  "base_fixture": {
    "product_contract": {"schema_id":"forgeops.task-contract","schema_version":"1.0","artifact_id":"task_contract:w6_fixture:v1","artifact_version":1,"task_id":"TASK-W6-FIXTURE","repository":{"id":"public-example/forgeops-fixture","snapshot_commit":"0123456789abcdef0123456789abcdef01234567","target_branch":"main"},"intent":{"type":"bug_fix","summary":"Change fixture/work-item.txt from before to after."},"acceptance_criteria":[{"id":"AC-W6-1","description":"fixture/work-item.txt changes from before to after","verification":"local_vertical_fixture"}],"constraints":[],"verification_policy":{"profile_id":"forgeops-local-vertical","baseline_command_ids":[],"required_command_ids":["main-part-work-main"],"require_new_regression_test":true},"risk":{"initial_level":"low","reasons":["public fixture only"]},"budget":{"max_repair_attempts":1,"max_tool_calls":20,"max_shell_commands":5,"max_runtime_seconds":120,"max_model_cost_usd":0},"approval_policy":{"plan":"not_required","dependency_change":"required","remote_push":"required","pr_draft":"required","merge_or_deploy":"never_without_explicit_high_risk_approval"}},
    "trusted_bridge_context": {"intent_mapping":{"bug_fix":"CHANGE"},"validation_profile":{"id":"forgeops-local-vertical","commands":[{"id":"main-part-work-main","command":"python tools/local_vertical/verify.py --schema contracts/forgeops-local-vertical/1.0/schema.json --product-schema contracts/product-task-contract/1.0/schema.json --snapshot-schema contracts/forgeops-snapshot-contract/1.0/schema.json --context-schema contracts/forgeops-context-pack/1.0/schema.json --suite fixtures/forgeops-local-vertical/suite.json --result artifacts/verification/vg-012-local-vertical-result.json --command-id main-part-work-main","cwd":"."}]},"canonical_control":{"project_profile":{"root":".","profile_type":"software","profile_status":"LOADED","source_of_truth":["direct_user_request","applicable_instruction_files","repository_files","fresh_tool_observations"],"protected_resources":[".git/**",".env",".env.*"],"risk_rules":["scope_expansion_requires_approval"]},"capabilities":{"filesystem_read":"AVAILABLE","filesystem_write":"AVAILABLE","command_execute":"AVAILABLE","delegation":"NONE","network":"UNAVAILABLE","external_side_effects":"UNAVAILABLE"},"authority":{"read_scope":"PROJECT","read_resources":[],"write_scope":"NAMED_RESOURCES","write_resources":["fixture/work-item.txt"],"execute_scope":"NONE","execute_commands":[],"network_scope":"NONE","network_hosts":[],"destructive_actions":"DENIED","external_side_effects":"DENIED"},"control":{"route":"PART_THEN_WORK","operation_mode":"EXPLORE","response_phase":"REPORT","risk_level":"LOW","evidence_floor":"E2","trace_level":"QUIET"},"budgets":{"format_repairs":1,"part_attempts":2,"work_attempts":2},"accepted_state":{"task_id":"TASK-W6-FIXTURE","correlation_id":"CORR-W6-FIXTURE","revision":1,"status":"IN_PROGRESS","next_seq":7},"tool_schema":{"source":"trusted-profile-only"}},"approval_policy_verified":false,"trusted_approval_policy":{"plan":"not_required","dependency_change":"required","remote_push":"required","pr_draft":"required","merge_or_deploy":"never_without_explicit_high_risk_approval"}},
    "accepted_state":{"task_id":"TASK-W6-FIXTURE","correlation_id":"CORR-W6-FIXTURE","revision":1,"status":"IN_PROGRESS","next_seq":7},
    "snapshot_manifest":{"snapshot_version":"1.0","snapshot_id":"sha256:aaaaaaaaaaaaaaaaaaaaaaaaaaaaaaaaaaaaaaaaaaaaaaaaaaaaaaaaaaaaaaaa","source":{"repository_label":"public-example/forgeops-fixture","head_sha":"0123456789abcdef0123456789abcdef01234567","git_state_sha256":"bbbbbbbbbbbbbbbbbbbbbbbbbbbbbbbbbbbbbbbbbbbbbbbbbbbbbbbbbbbbbbbb"},"dirty":false,"entries":[{"path":"fixture/work-item.txt","size":7,"sha256":"c0cde77fa8fef97d3b55e18e9a5f8f08c4f19b67b6dd8a19a0163aa1f8a5a7ab","mode":"100644","source_states":["tracked"]}],"deleted_paths":[],"manifest_sha256":"cccccccccccccccccccccccccccccccccccccccccccccccccccccccccccccccc"},
    "context_pack":{"context_pack_version":"1.0","snapshot_id":"sha256:aaaaaaaaaaaaaaaaaaaaaaaaaaaaaaaaaaaaaaaaaaaaaaaaaaaaaaaaaaaaaaaa","query_tokens":["fixture","work-item"],"items":[{"path":"fixture/work-item.txt","sha256":"c0cde77fa8fef97d3b55e18e9a5f8f08c4f19b67b6dd8a19a0163aa1f8a5a7ab","size":7,"media_type":"text/plain","selection_reason":["PATH_EXACT"],"score":100,"excerpt":"before\n","trust":"UNTRUSTED_SOURCE"}],"summary":{"selected":1,"excluded_binary":0,"excluded_oversized":0},"control_claims_accepted":false},
    "fixture_resource":{"path":"fixture/work-item.txt","before":"before\n","after":"after\n"},"validation_at":"2026-08-02T00:05:00Z","candidate_evidence_floor":"E2","human_review_result":null
  },
  "cases": [
    {"id":"POSITIVE_MAIN_PART_WORK_MAIN","kind":"positive","mutation":"NONE","expected_result":"PASSED"},
    {"id":"POSITIVE_GATE_WAITING","kind":"positive","mutation":"READ_NONE_GATE","expected_result":"PASSED"},
    {"id":"NEGATIVE_MAIN_PROTOCOL","kind":"negative","mutation":"MAIN_PROTOCOL","expected_error":"MAIN_CONTRACT_VERSION_UNSUPPORTED"},
    {"id":"NEGATIVE_PART_ENVELOPE_MISMATCH","kind":"negative","mutation":"PART_ENVELOPE_MISMATCH","expected_error":"PART_ENVELOPE_INVALID"},
    {"id":"NEGATIVE_PART_READ_NONE","kind":"negative","mutation":"PART_READ_NONE","expected_error":"PART_READ_AUTHORITY_DENIED"},
    {"id":"NEGATIVE_CONTEXT_HASH_MISMATCH","kind":"negative","mutation":"CONTEXT_HASH_MISMATCH","expected_error":"PART_CONTEXT_PROVENANCE_INVALID"},
    {"id":"NEGATIVE_PART_STATE_OWNERSHIP","kind":"negative","mutation":"PART_STATE_OWNERSHIP","expected_error":"PART_STATE_OWNERSHIP_FORBIDDEN"},
    {"id":"NEGATIVE_PROTECTED_NO_APPROVAL","kind":"negative","mutation":"PROTECTED_NO_APPROVAL","expected_error":"PART_PROTECTED_APPROVAL_REQUIRED"},
    {"id":"NEGATIVE_APPROVAL_WITHOUT_AUTHORITY","kind":"negative","mutation":"APPROVAL_WITHOUT_AUTHORITY","expected_error":"PART_WRITE_AUTHORITY_DENIED"},
    {"id":"NEGATIVE_HYBRID_IDENTITY","kind":"negative","mutation":"HYBRID_IDENTITY","expected_error":"WORK_ACTION_IDENTITY_INVALID"},
    {"id":"NEGATIVE_SCOPE_LIST_MISMATCH","kind":"negative","mutation":"SCOPE_LIST_MISMATCH","expected_error":"AUTHORITY_SCOPE_LIST_MISMATCH"},
    {"id":"NEGATIVE_WORK_ENVELOPE_MISMATCH","kind":"negative","mutation":"WORK_ENVELOPE_MISMATCH","expected_error":"WORK_ENVELOPE_INVALID"},
    {"id":"NEGATIVE_WORK_MODE_EXPLORE","kind":"negative","mutation":"WORK_MODE_EXPLORE","expected_error":"WORK_OPERATION_MODE_INVALID"},
    {"id":"NEGATIVE_WORK_CAPABILITY_UNKNOWN","kind":"negative","mutation":"WORK_CAPABILITY_UNKNOWN","expected_error":"WORK_CAPABILITY_DENIED"},
    {"id":"NEGATIVE_TRUST_APPROVED_ID_INJECTION","kind":"negative","mutation":"TRUST_APPROVED_ID_INJECTION","expected_error":"WORK_APPROVED_ID_INVALID"},
    {"id":"NEGATIVE_TRUST_VALIDATION_AT_INJECTION","kind":"negative","mutation":"TRUST_VALIDATION_AT_INJECTION","expected_error":"WORK_VALIDATION_AT_UNTRUSTED"},
    {"id":"NEGATIVE_PROJECT_EXECUTE_SCOPE","kind":"negative","mutation":"PROJECT_EXECUTE_SCOPE","expected_error":"AUTHORITY_EXECUTE_SCOPE_INVALID"},
    {"id":"NEGATIVE_WILDCARD_COMPANION","kind":"negative","mutation":"WILDCARD_COMPANION","expected_error":"AUTHORITY_RESOURCE_INVALID"},
    {"id":"NEGATIVE_RESOURCE_TRAVERSAL","kind":"negative","mutation":"RESOURCE_TRAVERSAL","expected_error":"RESOURCE_IDENTITY_NONCANONICAL"},
    {"id":"NEGATIVE_UNSUPPORTED_COMMAND","kind":"negative","mutation":"UNSUPPORTED_COMMAND","expected_error":"WORK_ACTION_TYPE_UNSUPPORTED"},
    {"id":"NEGATIVE_WORK_STALE_REVISION","kind":"negative","mutation":"WORK_STALE_REVISION","expected_error":"MAIN_WORK_REVISION_STALE"},
    {"id":"NEGATIVE_WORK_STATE_OWNERSHIP","kind":"negative","mutation":"WORK_STATE_OWNERSHIP","expected_error":"WORK_STATE_OWNERSHIP_FORBIDDEN"},
    {"id":"NEGATIVE_EVIDENCE_DANGLING","kind":"negative","mutation":"EVIDENCE_DANGLING","expected_error":"MAIN_EVIDENCE_REFERENCE_INVALID"},
    {"id":"NEGATIVE_EVIDENCE_STALE","kind":"negative","mutation":"EVIDENCE_STALE","expected_error":"MAIN_EVIDENCE_FRESHNESS_INVALID"},
    {"id":"NEGATIVE_EVIDENCE_FUTURE","kind":"negative","mutation":"EVIDENCE_FUTURE","expected_error":"MAIN_EVIDENCE_FRESHNESS_INVALID"},
    {"id":"NEGATIVE_EVIDENCE_LOW_TIER","kind":"negative","mutation":"EVIDENCE_LOW_TIER","expected_error":"MAIN_EVIDENCE_TIER_INVALID"},
    {"id":"NEGATIVE_CANDIDATE_COVERAGE","kind":"negative","mutation":"CANDIDATE_COVERAGE","expected_error":"MAIN_CANDIDATE_COVERAGE_INVALID"},
    {"id":"NEGATIVE_CRITERION_COVERAGE","kind":"negative","mutation":"CRITERION_COVERAGE","expected_error":"MAIN_CRITERION_COVERAGE_INVALID"},
    {"id":"NEGATIVE_SUMMARY_MISMATCH","kind":"negative","mutation":"SUMMARY_MISMATCH","expected_error":"MAIN_SUMMARY_INVALID"},
    {"id":"NEGATIVE_MAIN_ACTOR_OWNERSHIP","kind":"negative","mutation":"MAIN_ACTOR_OWNERSHIP","expected_error":"MAIN_ACTOR_OWNERSHIP_FORBIDDEN"}
  ]
}
